place_name,place_description
The High Line,"An elevated public park built on a former freight rail line, offering an urban oasis with beautiful landscaping, art installations, and views of the city and Hudson River. It's a beloved spot for locals seeking a peaceful retreat."
Nom Wah Tea Parlor,"A historic dim sum parlor in Chinatown, dating back to 1920, known for its authentic and reasonably priced dim sum. It's a cherished spot among New Yorkers for its nostalgic charm and delicious offerings."
Apotheke,"A hidden speakeasy bar disguised as a pharmacy, offering a unique cocktail experience in a fun and secretive setting. It's a local gem for those in the know, located near Nom Wah Tea Parlor."
Baylander Steel Beach,"A seasonal restaurant on a former navy vessel on the Hudson River, offering a unique dining experience with stunning sunset views. It's a memorable spot for locals seeking a nautical-themed outing."
East Village,"A vibrant neighborhood with a bohemian vibe, featuring artsy shops, vintage stores, indie bookshops, colorful street art around St. Mark’s Place, and cozy bars and music venues."
City Island,"A charming marina community in the North Bronx known for its fishing village atmosphere, numerous boats, and excellent seafood restaurants."
Prospect Park,"Designed by F.L. Olmstead, this park offers a unique experience compared to Central Park, with its expansive green spaces and natural beauty."
Cloisters,"Located in Northern Manhattan, this museum offers a serene escape with medieval art and architecture, complemented by the nearby New Leaf Cafe for a delightful dining experience."
Staten Island Ferry,"A free ferry ride offering stunning views of the New York Harbor, including the skyline, Statue of Liberty, and Ellis Island, making it a perfect spot for photography."
Vanderbilt Motor Parkway,"A hidden gem in Levittown, this historic trail was once home to the Vanderbilt Cup Races. The remnants of the old speedway, including grandstands and concrete paths, offer a nostalgic journey through a lesser-known piece of racing history."
State Museum in Albany,"A lesser-known museum that offers a rich tapestry of New York's history, from subway cars to Adirondack wildlife. It also features unique exhibits like the original Sesame Street set and World Trade Center debris."
Saratoga Battlefield National Park,A historically significant site where the pivotal Revolutionary War battle took place. This park offers a serene environment to explore the grounds where American forces triumphed over the British.
Finger Lakes Region,"Known for its stunning natural beauty, this region offers deep lakes, rolling hills, and over 100 wineries. It's a perfect destination for those seeking scenic views and leisurely wine tours."
Letchworth State Park,"Often referred to as the 'Grand Canyon of the East,' this park features a dramatic gorge carved by the Genesee River, complete with breathtaking waterfalls and lush landscapes."
"Aurora, NY","A quaint town on Cayuga Lake, surrounded by wineries and home to attractions like the Mackenzie-Childs headquarters and Long Point State Park, known for its unique 'lucky stones.'"
Burp Castle,"A tiny, hidden bar in the East Village known for its unique ambiance where bartenders dressed as monks enforce a quiet atmosphere, making it a peaceful retreat for beer enthusiasts."
Adirondack Experience,"Located in Blue Mountain Lake, this museum offers an immersive look into the Adirondack region's history and culture, set against a backdrop of stunning natural beauty."
Chimney Bluffs State Park,"Located in Wolcott, this park is famous for its dramatic, eroded cliffs along Lake Ontario, offering unique hiking trails and stunning views."
OK Slip Falls,"Situated in Indian Lake, this hidden waterfall is one of the tallest in the Adirondacks, offering a rewarding hike through lush forests to reach its breathtaking cascade."
Roosevelt Island Tram,"A bright red tram offering spectacular city views as it glides high above the East River, connecting Manhattan with the tranquil Roosevelt Island."
Met Cloisters,"A calming oasis focusing on medieval art and architecture, offering a serene escape from the bustling city, located a few miles north of the main Metropolitan Museum."
Morgan Library and Museum,"A breathtaking library featuring some of the world's rarest books and manuscripts, located just a few blocks from the New York Public Library."
Dyckman Farmhouse Museum,"The last farmhouse in Manhattan, dating back to 1785, offering a glimpse into New York City's rural past."
American Folk Art Museum,"A free museum boasting one of the most impressive collections of folk art in the United States, located near the Lincoln Center."
Greenacre Park,"A hidden oasis in Midtown Manhattan featuring a 25-foot waterfall, providing a peaceful retreat amidst the city's busiest blocks."
Gracie Mansion,"The historic residence of New York City's mayor, tucked away in Carl Schurz Park, offering tours of its elegant 1799 home."
Inwood Hill Park,"Home to the rugged 1.3-mile Orange Trail, offering historic sites, scenic overlooks, and Manhattan's largest remaining natural forest."
Albertine,"An enchanting bookstore offering a collection of French and English books, located near the Metropolitan Museum of Art."
Governors Island,"A car-free island known for its incredible views, outdoor recreation, and unique events like the Jazz Age Lawn Party, accessible via a short ferry ride from Lower Manhattan."
191st Street Tunnel,"New York's only underground street, featuring colorful graffiti murals, located at the city's deepest subway station."
Wave Hill,"Beautiful public gardens along the Hudson River in The Bronx, offering a peaceful escape from the city."
City Island,"A quaint neighborhood in The Bronx with a coastal New England vibe, featuring cottages, lighthouses, and seafood restaurants."
Snug Harbor Cultural Center & Botanical Garden,"A tranquil Staten Island destination with seasonal gardens, a heritage farm, and visual and performing arts programming."
IKEA Ferry to Red Hook,"A free weekend ferry ride from Wall Street to Red Hook, offering stunning views of downtown Manhattan and the Statue of Liberty. Red Hook boasts a unique vibe with cool restaurants and breweries, making it a delightful escape from the city's hustle."
Strong Rope Brewing,"Located in Red Hook, this brewery features a beautiful outdoor space with views of New York Harbor, downtown Manhattan, and the Statue of Liberty. It's a perfect spot to relax and enjoy local brews."
Hometown BBQ,"Renowned for serving the best BBQ in New York City, this Red Hook gem offers a mouthwatering culinary experience in a laid-back setting."
Greenwood Cemetery,"A scenic and historic cemetery near excellent dining options, offering a peaceful retreat with beautiful landscapes and a rich history."
Governor’s Island,"Accessible by ferry, this island offers scenic views and a tranquil escape from the city, with plenty of green spaces and historical sites to explore."
Carroll Gardens,A charming neighborhood known for its picturesque streets and vibrant community. Walking along Smith Street reveals a mix of historic architecture and trendy spots.
Gantry Plaza State Park,"Located in Long Island City, Queens, this park offers breathtaking views of the Midtown Manhattan skyline, including iconic buildings like the Empire State and Chrysler Buildings."
Brooklyn Heights,"Famous for its cobblestone streets and beautiful brownstone homes, this neighborhood provides a picturesque setting with a rich architectural heritage."
Brooklyn Bridge Park,"Offering stunning views of the lower Manhattan skyline and the iconic Brooklyn and Manhattan bridges, this park is a perfect spot for photography and leisurely walks."
Lower East Side,"A vibrant neighborhood with a mix of cultural and culinary experiences, including Yonah Shimmel knish, Casa Adela for Puerto Rican cuisine, and the Museum of Reclaimed Urban Space."
The Noguchi Museum,"Located in Astoria, Queens, this museum is a hidden gem for art lovers, showcasing the works of Japanese-American artist Isamu Noguchi in a serene and contemplative setting."
Wave Hill Public Garden & Cultural Center,"Nestled in the Bronx, this public garden offers stunning views of the Hudson River and a peaceful escape with its beautiful gardens and cultural programs."
Greenwood Cemetery,"A historic cemetery in Brooklyn known for its picturesque landscapes, historic monuments, and as a resting place for many famous New Yorkers."
The Morgan Library and Museum,"Situated on Madison Avenue, this museum is a treasure trove of rare books, manuscripts, and art, offering a glimpse into the world of literature and history."
The Cloisters,"Part of the Metropolitan Museum of Art, this museum in Washington Heights is dedicated to the art and architecture of medieval Europe, set in a tranquil park overlooking the Hudson River."
The Tenement Museum,"Located on the Lower East Side, this museum offers a unique look into the lives of immigrants in New York City through restored tenement apartments and guided tours."
The Irish Hunger Memorial,"A poignant memorial in the Financial District that commemorates the Great Irish Famine, featuring a recreated Irish landscape and historical information."
The Elevated Acre,"A hidden oasis in the Financial District, this elevated park offers a peaceful retreat with lush greenery and stunning views of the East River."
The Kristine Mann Library at the C.G. Jung Institute,"A specialized library in Midtown Manhattan dedicated to the works and studies of Carl Jung, offering a quiet space for research and reflection."
The New York Transit Museum,"Located in Downtown Brooklyn, this museum is a hidden gem for transit enthusiasts, showcasing the history of New York City's subway system with vintage trains and exhibits."
Little Italy in the Bronx,"Known as the 'real deal' Little Italy, this area is packed with authentic Italian delis, bakeries, and specialty stores, many still owned by the original families from the early 1900s."
The Morgan Library & Museum,"Originally J.P. Morgan's private library, this museum houses over 350,000 rare objects and offers cultural performances, making it a unique cultural gem in NYC."
North Woods in Central Park,"A tranquil green space with hiking trails, offering a peaceful escape from the city's urban environment."
Old St Patrick’s Cathedral,"Located in Nolita, this historic cathedral features catacombs dating back to 1815, accessible through a fascinating candlelight tour."
The Noguchi Museum,"A smaller yet impressive museum in Queens, showcasing the works of renowned sculptor Isamu Noguchi, including drawings, furniture designs, and a sculpture garden."
"The Campbell Bar, Grand Central Terminal","A hidden bar in Grand Central, restored to its original grandeur with hand-painted ceilings and a stone fireplace, offering a luxurious retreat."
Flushing Meadows Corona Park,"A versatile outdoor space with paddleboat rentals, walking trails, and remnants of two World Fairs, located near a vibrant Chinatown."
Woolworth Building,"An architectural gem built in 1913, known for its Gothic Revival style and historical significance, offering tours for architecture enthusiasts."
Old City Hall Station,"A beautiful and abandoned New York subway station from 1904, complete with chandelier, offering a glimpse into the city's architectural past."
Dream House,"An immersive experience created by La Monte Young and Marian Zazeela, where visitors are enveloped in an ever-changing world of sound and light."
Roosevelt Island Smallpox Hospital Ruins,"The haunting remains of a crumbling hospital from the 1850s, located on Roosevelt Island, offering a unique historical perspective."
The Elevated Acre,"A secluded garden oasis hidden above the bustling streets of the Financial District, providing a peaceful retreat amidst the urban chaos."
Mmuseumm,"A tiny museum housed in a New York freight elevator, specializing in the 'overlooked, dismissed, or ignored,' offering a unique take on curation."
Lexington Candy Shop,"The oldest family-run luncheonette in New York, last renovated in 1948, serving food and drinks the old-fashioned way, preserving a slice of history."
Trinity Place Bank Vault Bar,"A unique bar set in an old bank vault beneath a skyscraper in lower Manhattan, offering a historic and atmospheric drinking experience."
Le Boudoir,"A Marie Antoinette-themed speakeasy located in an abandoned 19th-century subway tunnel in Brooklyn, offering a unique and opulent experience."
"The Transit Museum, Brooklyn","Located in an abandoned subway station at Court Street, this museum showcases fully restored subway cars and offers a unique glimpse into the history of New York City's transit system."
Brooklyn Botanic Garden,"A magical and exceptionally beautiful garden that offers a serene escape from the bustling city, showcasing a variety of flowers and plants."
The Cloisters,"Situated in Fort Tryon Park, this branch of the Metropolitan Museum of Art is dedicated to medieval European art and architecture, providing a peaceful atmosphere with stunning views of the Hudson River."
City Hall Subway Station,"Known as New York's abandoned subway stop, this station is a hidden architectural gem with its beautiful design and historical significance."
Queens County Farm Museum,"Located in Little Neck, this working farm offers a glimpse into rural life with its historical buildings and farm activities, making it a unique attraction in the city."
Green-Wood Cemetery,"A historic cemetery in Brooklyn that offers picturesque landscapes, architectural wonders, and cultural events, along with stunning views of Manhattan."
City Island,A New England-style fishing village in the East Bronx known for its charming atmosphere and excellent seafood restaurants.
The Helmsley Building,"Located in the middle of Park Avenue, this building is a stunning example of Renaissance Revival architecture. It is often illuminated with different colors in the evening, highlighting its intricate details. Originally known as the Grand Central Building, it was renamed by Leona Helmsley, a notable figure in New York's real estate history."
DCTV Building,"Formerly a firehouse, this building on Lafayette Street is another remarkable example of French Renaissance Revival architecture in New York City. Its unique design and historical significance make it a hidden gem worth visiting."
Panorama of New York City - Queens Museum,"This 1:1200 scale model of New York City is a fascinating and lesser-known attraction. It features over 800,000 buildings and structures, offering a unique perspective of the city. The model covers all five boroughs and is a must-see for those interested in the city's architecture and history."
Fordham University's Rose Hill Campus,"Located in the Bronx, this campus is a hidden treasure with its beautiful architecture and serene environment. Visitors can explore the campus in the morning and then enjoy a meal in the nearby Bronx's Little Italy."
Woodlawn Cemetery,"Situated in the Bronx, this cemetery is known for its grand mausoleums designed by some of New York's finest architects. It offers a glimpse into the city's history and the lives of its elite from the late 19th and early 20th centuries."
Merchant's House Museum,"This East Village museum offers a rare view into mid-19th century life. The house, built in 1835, remained unchanged for 100 years and provides a fascinating glimpse into the past with its preserved interiors and historical artifacts."
Brooklyn Botanic Garden,"A magical and exceptionally beautiful place, this garden offers a peaceful escape from the bustling city. It's a lesser-known attraction that showcases the natural beauty of New York, making it a perfect spot for relaxation and exploration."
The Prison Ship Martyrs’ Monument at Fort Greene Park,"A historical monument commemorating nearly 12,000 American prisoners of war who died on British prison ships during the American Revolution. Located in Fort Greene Park, it offers a serene environment with historical significance and is best visited in the evenings to enjoy the fireflies."
Brooklyn Grange Rooftop Farm,"An organic, sustainable rooftop farm reviving Brooklyn's agricultural past. Producing over 80,000 pounds of vegetables annually, it offers farm tours, workshops, and unique products like farmstand honey and hot sauce."
Brighton Beach,"A local favorite beach next to Coney Island, known for its 'Little Odessa' neighborhood. Offers a unique cultural experience with Russian-Uzbek-Korean cuisine and a relaxed boardwalk atmosphere."
Brooklyn Banya Bathhouse,"A traditional Russian bathhouse in Ditmas Park featuring saunas, jacuzzis, and a unique exfoliation experience with oak leaf bundles. A cultural gem offering relaxation and rejuvenation."
Bushwick Open Studios,"A vibrant art event in Bushwick, showcasing hundreds of artist studios and extensive street murals. Offers a unique glimpse into NYC's creative community with self-guided walking tours of street art."
Sunset at Brooklyn Heights Promenade,"A quieter alternative to Brooklyn Bridge Park, offering stunning views of downtown Manhattan and southern Brooklyn. Ideal for a peaceful stroll with scenic vistas."
Karasu,"A hidden Japanese-style speakeasy inside Walter’s restaurant, offering a moody ambiance and unique culinary experiences like Blistered Shishito Peppers paired with Japanese whisky."
Sort-of-secret Brooklyn block parties,"Local block parties offering a community-centric experience with barbecues, music, and friendly gatherings. These spontaneous events capture the essence of Brooklyn's neighborhood spirit."
Bushwick Street Art Collective,"A compact yet impressive collection of street art in Bushwick, featuring works by local artists. This vibrant display transforms ordinary streets into open-air galleries, showcasing the area's creative spirit."
Prospect Park,"A serene escape designed by Frederick Law Olmsted and Calvert Vaux, offering vast meadows, serene water bodies, and lush greenery. It's a refuge for nature enthusiasts, teeming with diverse wildlife and perfect for picnics."
DUMBO,"A vibrant artistic neighborhood beneath the Manhattan Bridge, known for its galleries, boutiques, and captivating street art. It offers a rich cultural experience with venues like St. Ann's Warehouse and the Brooklyn Academy of Music."
Williamsburg,"An artist's paradise with a vibrant creative atmosphere, trendy shops, unique eateries, and exciting nightlife. The neighborhood is known for its street art, vintage stores, and iconic music venues like the Music Hall of Williamsburg."
Greenpoint Terminal Market,"An enchanting indoor market in a transformed warehouse, offering vintage clothing, artisanal goods, and authentic Polish meals. It's a hidden gem for unique shopping experiences and cultural exploration."
Brooklyn Ninja Academy,"A unique fitness venue inspired by Ninja Warrior, offering training sessions and competitions for those passionate about calisthenics and bodyweight-based movement."
Public Records,"A multi-faceted space in Gowanus with a custom-built sound system, hosting a range of live acts, DJs, and producers. It's a central hub for Brooklyn's electronic music scene, offering a vibrant nightlife experience."
Elsewhere,"A multi-room venue in Bushwick set across three stories, specializing in underground music. It offers warehouse-style rave nights and a focus on inclusion and good vibes, making it a staple of Brooklyn's nightlife."
Carrol Gardens,"A charming neighborhood known for its tree-lined streets and historic brownstones, offering a quaint escape from the bustling city life."
Prospect Heights,"A vibrant area with a mix of cultural attractions, including the Brooklyn Museum and the Brooklyn Botanic Garden, making it a cultural oasis in the city."
Crown Heights,"An eclectic neighborhood with a rich history and diverse community, known for its beautiful architecture and cultural festivals."
Clinton Hill,"A picturesque neighborhood with a blend of historic and modern architecture, offering a peaceful retreat with its lush parks and artistic vibe."
Williamsburg,"A trendy area known for its hipster culture, vibrant arts scene, and waterfront views, making it a hotspot for creativity and innovation."
The Brick Theater,"Located on Metropolitan-Lorimer, this theater is known for its focus on experimental performances, offering a unique cultural experience and a place to make new friends."
Wonderville,"A fun barcade featuring unique and handmade games, providing a quirky and entertaining atmosphere for visitors."
Maria Hernandez Park,"A vibrant park hosting local parties, cultural events, and activist gatherings, surrounded by colorful streets and charming shops and eateries."
Ditmas Park,"Known for its awe-inspiring massive Victorian houses, offering a picturesque and tranquil neighborhood walk."
Greenwood Cemetery,"A peaceful and quiet place with events like NY Philharmonic performances, providing a serene escape with cultural offerings."
House of Yes,"Located in Bushwick, this venue is known for its amazing buildings and vibrant atmosphere, featuring old breweries, churches, and huge townhouses."
The Hole,"A neighborhood significantly lower than its surroundings, offering an intriguing 'end of the line' feel with its unique landscape."
Wild Birds,"A truly hidden gem known for its unique ambiance and charm, offering a cozy spot for drinks and socializing. Despite its closure, it remains a fond memory for those who experienced its inviting atmosphere."
Bushwick Street Art Tour,"Explore the vibrant street art scene in Bushwick, where colorful murals tell unique stories. A self-guided tour reveals hidden artistic gems in this creative neighborhood."
Win Son,"A culinary favorite in Brooklyn, Win Son offers a delightful fusion of Taiwanese flavors in a cozy setting, making it a must-visit for food enthusiasts."
Barbès,"An iconic music venue known for its eclectic live performances, Barbès offers an intimate atmosphere perfect for discovering new sounds."
Grimm Artisanal Ales,"Located in Bushwick, this brewery is a hidden gem for craft beer lovers, offering a unique selection of artisanal ales in a laid-back environment."
Prospect Park,"Designed by the same architects as Central Park, Prospect Park is a lush oasis in Brooklyn, featuring the borough's only legitimate forest and a serene escape from the city."
L Train Vintage,"A treasure trove for thrift enthusiasts, L Train Vintage offers a wide array of unique and affordable vintage clothing, perfect for those seeking one-of-a-kind fashion finds."
Polonika,"A hidden gem for Polish cuisine, known for its delicious pierogis and hearty mushroom soup that serves as a meal in itself."
Family Store,"A unique spot offering a mix of Middle Eastern and other cuisines, famous for its crab cake sandwich and diverse selection of empanadas."
Barkaloo Cemetery,"The smallest cemetery in Brooklyn, located behind Xaverian High School, offering a quaint and historical charm."
Cellary,"A wine shop with a knowledgeable staff and a charming blind dog named Wendy, offering a unique selection of wines and a warm, welcoming atmosphere."
Tacos El Bronco,"Located in Sunset Park, this spot is renowned for serving the best tacos in the city, making it a must-visit for taco enthusiasts."
The Hill on Ridge Blvd,"A steep dead-end street with stairs from Colonial Road, offering a challenging workout and a house with a Gothic horror film aesthetic, providing stunning views of the Harbor."
Flushing Main Street,"A vibrant area in Queens, NYC, known for its diverse cultural experiences and authentic Asian cuisine. Visitors can explore bustling markets, unique shops, and enjoy a variety of traditional dishes, making it a memorable and off-the-beaten-path destination."
Williamsburg,"A unique neighborhood where old vicissitudes blend with modern and innovative buildings, offering authentic restaurants, shops, and cafes. Known for its beautiful graffiti art and local breweries, Williamsburg provides a vibrant atmosphere for those who love locally brewed beer and dining with locals."
Dumbo,"Located under the Manhattan Bridge, Dumbo offers stunning waterfront views and iconic photo spots like the Washington Street photo stop. It's home to attractions like the Empire State Store and Jane’s Carousel, making it a picturesque and culturally rich area to explore."
Fort Greene,"Known for its rich history and cultural diversity, Fort Greene features tree-lined streets and the tranquil Fort Greene Park. The neighborhood boasts a thriving arts scene with galleries, theaters, and music venues, offering a vibrant urban lifestyle with a touch of serenity."
Crown Heights,"Home to the Brooklyn Museum and Brooklyn Botanic Garden, Crown Heights offers cultural and natural attractions. The museum houses works by renowned artists, while the Botanic Garden features the famous Cherry Esplanade and Japanese Landscape Garden, providing a blend of art and nature."
Atlantic Avenue,"A charming district known for its distinctive boutiques and historic 19th-century architecture, attracting visitors from across the city."
Brighton Beach,"Nicknamed 'Little Russia,' this area offers a unique blend of 'old country' charm with modern American commerce, featuring ethnic Russian restaurants and shops."
DUMBO Improvement District,"A vibrant area offering a mix of creative dining options and unique shopping experiences, from handcrafted goods to vintage finds."
FAB FULTON,"Located in Fort Greene and Clinton Hill, this area is known for its great art and culture, amazing food, historic architecture, and beautiful tree-lined streets."
