place_name,place_description
Lower East Side Tenement Museum National Historic Site,"This museum offers a unique glimpse into the lives of immigrants who lived in the Lower East Side from 1863 to 1935. Through guided tours, visitors can explore restored apartments and hear personal stories of the families who once called them home, providing a rich narrative of New York's immigrant history."
Stonewall National Monument,"Located in Greenwich Village, this monument commemorates the Stonewall Uprising of 1969, a pivotal event in the LGBT civil rights movement. The site includes the historic Stonewall Inn and surrounding areas, symbolizing the fight for equality and freedom."
African Burial Ground National Monument,"This site in the Financial District is the oldest and largest known excavated burial ground in North America for both free and enslaved Africans. It serves as a poignant reminder of the role slavery played in building New York City, with a visitor center offering educational exhibits."
Congaree National Park,"Located in South Carolina, Congaree National Park is a hidden gem known for preserving the largest expanse of old-growth bottomland hardwood forest in the U.S. This unique environment, formed by evergreen hardwood trees growing from floodplains, offers a rare biome with iconic flora like cypress and oak. Visitors can explore this enchanting ecosystem through hiking trails, bridges, and canoeing opportunities, all without the crowds of more famous parks."
Dry Tortugas National Park,"Located in Florida, this remote national park is known for its stunning coral reefs, historic Fort Jefferson, and crystal-clear waters, offering a unique blend of natural beauty and historical significance."
Marsh-Billings-Rockefeller National Historical Park,"Situated in Vermont, this park is a hidden gem for its rich history and beautiful landscapes, showcasing the legacy of conservation and land stewardship in America."
Gates of the Arctic National Park and Preserve,"As the least-visited national park in 2023, this Alaskan wilderness offers unparalleled solitude and pristine natural beauty, with vast landscapes untouched by roads or trails."
National Park of American Samoa,"This park offers a unique cultural and natural experience, with lush rainforests, vibrant coral reefs, and a rich Samoan cultural heritage, making it a hidden gem in the Pacific."
Lake Clark National Park and Preserve,"Located in Alaska, this park is a hidden gem for its stunning scenery, including active volcanoes, glacial lakes, and abundant wildlife, offering a true wilderness experience."
Kobuk Valley National Park,"Known for its Great Kobuk Sand Dunes, this remote Alaskan park offers a unique landscape of sand dunes amidst the Arctic wilderness, providing a rare and captivating experience."
Isle Royale National Park,"Situated in Lake Superior, this park is a hidden gem for its rugged, isolated beauty, offering opportunities for hiking, kayaking, and observing diverse wildlife in a serene setting."
Katmai National Park and Preserve,"Famous for its brown bears and the Valley of Ten Thousand Smokes, this Alaskan park offers a unique combination of wildlife viewing and volcanic landscapes, making it a hidden treasure."
North Cascades National Park,"This park in Washington state is a hidden gem for its dramatic mountain scenery, with jagged peaks, deep valleys, and over 300 glaciers, offering a pristine wilderness experience."
Wrangell-St. Elias National Park and Preserve,"As the largest national park in the U.S., this Alaskan park is a hidden gem for its vast, rugged landscapes, including towering mountains, glaciers, and diverse wildlife, providing an unparalleled adventure."
6BC Botanical Garden,"Located in the East Village, this nearly 40-year-old garden is a lush, otherworldly space dedicated to biodiversity and horticulture education. It features a small fish pond, a meandering brick path, and a pergola wrapped in blooming vines."
The Church of St. Luke in the Fields Garden,"Situated in the West Village's historic district, this garden offers an oasis filled with leafy trees, wildflowers, and blooming bushes. It attracts over 100 species of birds and two dozen types of butterflies and moths, providing a serene escape from the city."
Tudor City Greens,"These gardens are hidden above street level, offering a quiet escape from the city's chaos. Located near Grand Central and the United Nations, they provide a peaceful retreat with mature trees and lush plantings."
Heather Garden,"Part of Fort Tryon Park, this three-acre garden offers stunning views of the Hudson River. It features a mix of trees, flowering shrubs, and perennials, including one of the largest collections of heath and heather on the East Coast."
Bruce's Garden,"Located at the northernmost tip of Manhattan, this garden is a delightful space with mature trees, ornamental flowers, and two beehives. It was named in honor of Bruce Reynolds, a Port Authority Police Officer who died in the September 11th attacks."
Willis Ave Community Garden,"A large community garden in the South Bronx, it features a 12’ by 36’ casita, a compost toilet, a regraded lawn, and a mulched picnic area. The garden is adorned with leafy vines and birch trees, offering a vibrant green space."
Bartow-Pell Mansion Museum Gardens,"These formal terraced gardens, designed by Delano & Aldrich in 1915, are lesser-known but open to the public. They feature rotating sculpture installations and are encased within a masonry wall with a central square pool."
Windmill Community Garden,"A newcomer to Long Island City, this garden transformed a vacant lot into a mix of passive seating areas and planting beds. It partners with Flux Factory for temporary exhibitions and events, creating a vibrant community space."
Smiling Hogshead Ranch,"An urban farm located on a disused LIRR spur, it features pergola-covered picnic tables, personal planting plots, and a wooded area left wild. The garden hosts regular public events, making it a unique community hub."
Green Dome Garden,"A quiet zone in McCarren Park, this 2,500-square-foot garden is a bloom-filled oasis with a Belgium block pathway and multiple plant habitats. It's a perfect spot to relax and enjoy the tranquility amidst the park's activity."
Naval Cemetery Landscape,"Part of the Brooklyn Greenway Initiative, this revitalized space features winding observation paths, a memorial meadow, and a 'sacred grove.' It pays homage to the naval officers and Marines once laid to rest at the site."
Gil Hodges Community Garden,"Also known as the Carroll Street Garden, it features permeable pavers, flood-tolerant plants, and a rain garden that absorbs stormwater. The garden includes a birch reading grove, patio, and a fragrance walk with sweet magnolia and orange azalea."
New York Chinese Scholar's Garden,"Located in Staten Island, this garden is based on Ming Dynasty designs and features moon gates, rocky landscapes, and eight picturesque pavilions. It offers a serene escape with paths through a bamboo forest, waterfalls, and a koi pond."
The Enchanted Forest,"A mystical woodland area known for its vibrant flora and hidden fairy-tale sculptures, offering a serene escape from the bustling city life."
Whispering Caves,"A series of secluded caves with unique acoustics, where the sound of the wind creates a natural symphony, providing a tranquil and awe-inspiring experience."
Starlight Lagoon,"A hidden lagoon that glows under the moonlight due to bioluminescent plankton, creating a magical nighttime spectacle."
The Secret Garden,"An off-the-beaten-path botanical garden filled with rare and exotic plants, offering a peaceful retreat for nature lovers."
The Forgotten Library,"An ancient library tucked away in a quiet corner of the city, housing rare manuscripts and offering a glimpse into the past."
Sunset Park,"Located in South Brooklyn, Sunset Park offers a stunning view of the Manhattan skyline, especially during sunset. It's a peaceful spot to appreciate the city's beauty away from the hustle and bustle of Manhattan."
The Cloisters,"Nestled in Fort Tryon Park, this annex of the Met showcases medieval European art and architecture. The building itself, constructed from European monasteries, offers a unique, historical ambiance."
Fort Tryon Park,"Designed by Frederick Law Olmsted Jr., this park in Washington Heights provides an intimate outdoor experience with breathtaking views and beautiful gardens, offering a serene escape from the city's chaos."
"Flushing, Queens","Known for its diverse Asian cuisine, Flushing offers a less overwhelming experience than Manhattan's Chinatown, with a variety of authentic restaurants and a vibrant cultural scene."
Long Island City,"Home to MoMA PS1 and other cultural attractions, LIC offers cutting-edge art shows and a vibrant arts scene, rivaling Chelsea's galleries in quality."
Bushwick street art,"Bushwick's alleys and warehouses are adorned with vibrant murals by local artists, offering an outdoor gallery experience perfect for capturing Instagram-worthy photos."
"New York Public Library, Stephen A. Schwarzman Building","This iconic library, guarded by marble lions, features the stunning Rose Reading Room and houses millions of items, offering a grand and inspiring public space."
Brooklyn Bridge Park,"Offering the same views as the Brooklyn Bridge but with more space and tranquility, this park provides a scenic waterfront experience with attractions like Jane’s Carousel."
Snug Harbor Cultural Center,"Located on Staten Island, this former retirement home for sailors is now an arts center and botanical garden, featuring unique gardens like the Chinese Scholar’s Garden and the Connie Gretz Secret Garden."
Lincoln Center for the Performing Arts,"With its stunning architecture and diverse performances, Lincoln Center offers an elegant environment for enjoying opera, ballet, and more, away from the tourist crowds of Radio City Music Hall."
The Royal Tenenbaums house,"This private residence in Hamilton Heights, featured in Wes Anderson's film, is known for its beautiful architecture and is available for stays on Airbnb, offering a unique cinematic experience."
L'Appartement 4F,"This bakery offers buttery croissants and Parisian pastries that transport you to Paris, known for its best-selling tahini chocolate chip cookie au sel de mer."
Museum of Mathematics,"Located in Flatiron, MoMath makes math accessible and fun, offering interactive exhibits that challenge the traditional perception of mathematics."
Little Island NYC,"A unique public park built on the remnants of an old pier on Manhattan's west side. Funded by Diane von Furstenberg and Barry Diller, this 2.4-acre green oasis offers stunning views of the Hudson River and Manhattan skyline. It's a peaceful escape with gardens and occasional performances, making it a charming spot for relaxation."
Marie’s Crisis,"A beloved West Village bar where locals gather around a piano to sing Broadway show tunes. Known for its welcoming atmosphere and long-standing staff, it's a hidden gem for those who love musical theater and a lively, communal experience."
Governors Island,"A former military academy turned public space, offering a unique blend of history and recreation. With empty historic buildings, expansive lawns, and views of the Statue of Liberty, it's a perfect spot for picnics, biking, and exploring art installations."
Brooklyn Bridge Park,"Located at the foot of the Brooklyn Bridge, this park offers stunning views of the Manhattan skyline, making it a perfect spot for photography and relaxation away from the bustling city."
Staten Island Ferry,"A free ferry service that provides breathtaking views of the Statue of Liberty and the New York City skyline, offering a unique perspective of the city from the water."
Roosevelt Island Tram,"For the cost of a subway fare, this tram ride offers panoramic views of Manhattan and Queens, providing a scenic and affordable way to experience the city from above."
Hudson River Greenway,"A scenic bike path along the Hudson River offering ten miles of uninterrupted views of Manhattan, perfect for cycling enthusiasts and those looking to enjoy the city's natural beauty."
Aaron Burr-Hamilton Duel Site,"Located in Weehawken, NJ, this historical site offers a spectacular view of the New York City skyline, providing a memorable experience for visitors seeking a unique vantage point."
Wythe Hotel Rooftop,"Situated across the East River in Brooklyn, this rooftop bar offers a stunning view of the Manhattan skyline, especially beautiful at sunset or at night, making it a hidden gem for both locals and visitors."
Arthur Avenue,"Known as the Little Italy of the Bronx, Arthur Avenue offers an authentic Italian experience reminiscent of what Manhattan's Little Italy used to be. It's a haven for delicious pasta, cannolis, and a vibrant cultural atmosphere."
Dyckman Farmhouse,"A 200+ year-old farmhouse turned museum in Northern Manhattan, offering a glimpse into the city's rural past amidst the urban landscape."
"Flushing, Queens","A vibrant neighborhood known for its authentic Asian cuisine, offering a culinary adventure with options like steaming dumplings and sizzling Korean BBQ."
The High Line,"An elevated linear park built on a historic freight rail line, offering stunning views of the Hudson River and a unique urban walking experience."
The Strand,"Located in Union Square, this massive used bookstore is a treasure trove for book lovers, offering a vast collection of rare and unique finds."
Brooklyn Botanic Garden,"A magical and exceptionally beautiful garden that offers a serene escape from the bustling city, featuring a diverse array of flora and stunning landscapes."
The Frying Pan,"An old hurricane watching ship docked at the west side piers, offering a unique experience to explore a historic vessel and enjoy the waterfront ambiance."
City Hall Subway Station,"Also known as New York's abandoned subway stop, this hidden gem is a beautifully designed station with intricate architecture, offering a glimpse into the city's transit history."
Queens County Farm Museum,"A real working farm located in Little Neck, offering a rural escape within the city and showcasing the agricultural history of Queens."
The Cloisters,"A branch of the Metropolitan Museum of Art located in Fort Tryon Park, dedicated to medieval European art and architecture, providing a serene atmosphere and stunning views of the Hudson River."
Green-Wood Cemetery,"A historic cemetery in Brooklyn known for its picturesque landscapes, architectural wonders, and as the final resting place for many notable figures, offering cultural events and walking tours."
City Island,"A New England-style fishing village in the East Bronx, known for its charming atmosphere and excellent seafood restaurants."
Fort Tryon Park,"A serene escape in Manhattan, offering breathtaking views of the Hudson River and the George Washington Bridge. Known for its lush gardens and the Cloisters Museum, it provides a peaceful retreat from the city's hustle."
Gantry Park,"Located in Long Island City, this park offers stunning nighttime views of the Manhattan skyline. It's a perfect spot for a quiet evening stroll or a romantic date."
The Panorama of New York City - Queens Museum,"A unique 1:1200 scale model of New York City, showcasing over 800,000 buildings and structures. It's a fascinating way to see the entire city in miniature form."
City Island,"A charming island in the Bronx reminiscent of New England, known for its seafood shacks, quaint houses, and beautiful cemetery. It's a delightful place for a leisurely walk and a seafood meal."
Roosevelt Island,"Accessible via tram, this island offers a glimpse of a historic smallpox hospital and provides a fantastic skyline view of Manhattan. It's a peaceful escape with a touch of history."
The Cloisters,"A museum dedicated to medieval art, located in Fort Tryon Park. It houses a significant collection of John Rockefeller's medieval art and offers scenic views of the Hudson River."
Washington Square Park,"A vibrant park in Greenwich Village, perfect for people-watching. It's a hub of activity with musicians, artists, and performers, offering a slice of New York's eclectic culture."
City Hall Subway Station,"An abandoned subway station with stunning architecture, visible if you stay on the 6 train past the last stop. It's a hidden architectural gem beneath the city streets."
The Panorama of New York City - Queens Museum,"A 1:1200 scale model of all five boroughs of New York City, showcasing over 800,000 buildings and structures. This intricate model allows visitors to see the entirety of New York City on a quarter-acre of floor space, offering a unique perspective of the city's architecture and layout."
The Helmsley Building,"Located in the middle of Park Avenue, this building is known for its Renaissance Revival details and evening light displays. Originally the Grand Central Building, it offers a stunning silhouette against the MetLife Building and is a testament to New York's architectural history."
DCTV Building,"Formerly a firehouse, this building on Lafayette Street is an excellent example of French Renaissance Revival architecture in NYC. Its unique design and historical significance make it a hidden gem for architecture enthusiasts."
Woodlawn Cemetery,"Situated in the Bronx, this cemetery is home to elaborate mausoleums designed by some of New York's finest architects. It serves as a historical resting place for the city's elite from the late 19th and early 20th centuries, offering a glimpse into the opulence of the era."
The Met Cloisters,"Located in a quiet corner of Manhattan, this museum features actual medieval cloisters and offers a serene escape from the city's hustle. It is less popular than its parent, the Metropolitan Museum, providing a peaceful and culturally rich experience."
The Morgan Library & Museum,"A haven for book lovers, this museum houses one of the few copies of the Gutenberg Bible. It offers a unique blend of art, literature, and history, making it a must-visit for those seeking a quieter cultural experience."
Le Boudoir,"A Marie Antoinette–themed speakeasy located in an abandoned 19th-century subway tunnel, offering a unique and historical ambiance."
Brooklyn Superhero Supply Store,"A quirky store catering to superhero and villain enthusiasts, providing a whimsical shopping experience."
Sunshine Laundromat,"A laundromat with a hidden bar featuring one of New York's best collections of pinball machines, offering a playful and unexpected nightlife experience."
House of Wax,"A bar in a downtown Brooklyn mall showcasing a rare anatomical wax collection from the 1920s, blending history with a modern drinking experience."
Robotic Church,"A former Norwegian sailor's church now home to a collection of robot musicians, creating a unique fusion of art and technology."
Bellocq Tea,"A hidden 'tea atelier' in Greenpoint, Brooklyn, known for its charming atmosphere and artisanal tea blends."
William Vale,"A rooftop bar on the 22nd floor offering stunning sunset views of the Manhattan skyline across the East River, perfect for a relaxing evening away from the crowds."
Paulie Gee's,"Located in Greenpoint, this pizzeria is renowned for its unique 'Hell's Boy' slice, featuring pepperoni and hot honey, offering a delightful twist on classic New York pizza."
Syrena Bakery,"A beloved bakery in Greenpoint known for its authentic Polish pierogies and baked goods, serving the community since the early 90s."
Domino Park,"A 5-acre park along the East River in Williamsburg, offering scenic views, an elevated walkway, a dog park, and proximity to popular dining spots like Tacocina and Misi."
Giglio Feast,"An annual Italian festival in Brooklyn featuring parades, food stalls, and the impressive 'Dancing of the Giglio,' celebrating the borough's rich Italian heritage."
Victorian Flatbush and Ditmas Park,"A hidden gem in Brooklyn, known for its fantastic homes and beautiful landscaping, offering a glimpse into the area's rich architectural history."
Brooklyn Terminal Market,"Located on Foster Ave in Canarsie, this open-air market offers great deals on flowers, landscaping supplies, and seasonal decorations, making it a unique shopping experience."
Green-Wood Cemetery,"A peaceful and unexpected retreat in Brooklyn, offering serene paths and stunning views, perfect for a quiet escape."
Jalopy Theatre,"A cozy venue in Brooklyn with a vintage vibe, ideal for discovering new artists and enjoying live music in an intimate setting."
Littlefield,"A quirky venue in Gowanus, Brooklyn, known for its comedy and art shows, providing a unique cultural experience."
Sunken Harbor Club,"A secret speakeasy hidden above a tiki bar in Downtown Brooklyn, offering a mysterious and exclusive nightlife experience."
Victorian Flatbush and Ditmas Park,"A hidden gem in Brooklyn, known for its stunning Victorian homes and beautifully landscaped gardens, offering a glimpse into the area's historical charm."
Brooklyn Terminal Market,"Located on Foster Ave in Canarsie, this open-air market is a treasure trove for bargain hunters, offering great deals on flowers, landscaping supplies, and seasonal decorations."
Green-Wood Cemetery,"A peaceful and unexpectedly beautiful spot in Brooklyn, offering serene paths and picturesque views, making it a perfect escape from the city's hustle."
Littlefield,"A quirky venue in Gowanus, Brooklyn, known for its eclectic mix of comedy and art shows, providing a unique cultural experience."
Sunken Harbor Club,"A secret speakeasy hidden above a tiki bar in Downtown Brooklyn, offering a unique and exclusive nightlife experience."
Forest Hills Gardens,"A charming neighborhood in Queens modeled after an English village, featuring quaint Tudor-style houses and a picturesque town center with a train station, offering a slice of the UK in NYC."
The Met Cloisters,"A medieval castle-like branch of The Metropolitan Museum of Art in Washington Heights, devoted to European art history, designed with elements from various medieval cloisters."
"The Ravine/Loch, Central Park","A hidden section in Central Park's North Woods, featuring a stream valley with five man-made waterfalls, designed to evoke the feeling of the Catskills or Adirondacks."
Villa Charlotte Bronte,"An Italian villa-inspired apartment complex in The Bronx, built in 1926, with balconies and lush gardens overlooking the Hudson River."
Roosevelt Island Tramway,"The only aerial commuter tram in the U.S., offering breathtaking views of NYC from 250 feet above the East River, originally built to serve Roosevelt Island residents."
Fort Tryon Park,"Home to the historic Billings Arcade, remnants of the Tryon Hall mansion, featuring massive stone arches that transport visitors to another era."
"Island Oyster, Governors Island","A waterfront bar offering a tropical island vibe with sea breezes and skyline views, accessible by a short ferry ride from Manhattan."
City Island,"A small seaside town-like area in The Bronx, known for its fresh seafood, outdoor restaurants, and quaint museums, shops, and galleries."
Greenacre Park,"A tiny park in Midtown East with a 25-foot waterfall, providing a serene escape from the city's hustle and bustle."
Andrew Carnegie Mansion,"A historical mansion on the Upper East Side, now the Cooper Hewitt Smithsonian Design Museum, featuring an expansive garden and cafe."
Morgan Library,"A historical library in Murray Hill, resembling an old-world European library, housing rare manuscripts and early printed books."
"Little Paris, Nolita/SoHo","A French cultural enclave on Centre Street, featuring French cafes, wine bars, and shops, with architecture inspired by Paris's Hotel de Ville."
Van Cortlandt House,"The oldest surviving building in The Bronx, a former plantation house turned museum, located in Van Cortlandt Park with unique hiking trails."
Stone Street,"A rare cobblestone street in the Financial District, offering an old European feel with outdoor seating and street drinking allowed."
Ford Foundation Garden,"A hidden garden in Midtown with a 160-foot tall atrium, featuring 39 plant species, a reflecting pool, and a sensory garden."
Jamaica Bay Wildlife Refuge,"A vast natural area in Queens, perfect for hiking, bird-watching, and exploring diverse wildlife and plant species."
Brooklyn Botanic Garden,"A lush oasis in Brooklyn, known for its cherry blossom blooms in spring, offering a year-round natural haven with diverse plant life."
L’Appart,"A cozy 28-table French tasting-menu restaurant in Battery Park City, offering a romantic dining experience with views of the Hudson River and an open kitchen."
St. Luke in the Fields Gardens,"A hidden urban oasis in the West Village, offering a picturesque and serene escape from the city's hustle, reminiscent of stepping into a magical world."
The Cloisters,"A romantic museum in Washington Heights featuring medieval art and architecture, including the famous Unicorn Tapestries and the 12th-century Fuentidueña Chapel."
The Campbell,"A landmarked cocktail bar inside Grand Central with a historic ambiance, featuring wooden ceilings, a stone fireplace, and leaded-glass windows."
La Noxe,"A secretive cocktail lounge near the 28th Street subway station, offering an intimate setting with tapas and unique drinks in a hidden, cozy atmosphere."
The Butterfly Conservatory at AMNH,"An enchanting indoor rainforest at the American Museum of Natural History, where visitors can walk among 500 vibrant butterflies in a warm, tropical setting."
Banzarbar,"An intimate bar on the second floor of Freemans, offering a unique 18th-century seaside tavern vibe with dim lighting and seafaring decor."
