place_name,place_description

The Cloisters,"A unique museum located in Fort Tryon Park, offering a serene escape with medieval art and architecture, surrounded by beautiful gardens."
Bohemian Beer Garden,"A charming outdoor beer garden in Astoria, known for its lively atmosphere and authentic Czech and Slovak beers."
Carl Schurz Park,"A peaceful riverside park on the Upper East Side, featuring beautiful views, dog-friendly areas, and the historic Gracie Mansion."
Tenement Museum,A fascinating museum on the Lower East Side that offers immersive tours into the lives of immigrants who lived in the tenement buildings.
Neighborhood Garden between Columbus/Amsterdam,"A hidden oasis on the Upper West Side, spectacular during tulip season, offering a tranquil escape from the city's hustle and bustle."
The Cloisters,"A serene museum in upper Manhattan, offering a peaceful retreat with its medieval art and architecture, surrounded by beautiful gardens."
Heather Garden in Fort Tryon Park,"Possibly the most beautiful public garden in New York City, offering a stunning array of flowers and plants with breathtaking views."
Queens Night Market,"A vibrant night market featuring diverse food vendors, offering a taste of global cuisines in a lively atmosphere."
"Brownsville, Brooklyn","An up-and-coming neighborhood with charming shops, offering a unique local experience away from the typical tourist spots."
Venhue,"Located in the East Village, Venhue offers a unique dining experience that avoids the influencer-driven aesthetics, focusing instead on delivering delicious and interesting food."
Foxface,"A hidden gem in the East Village, Foxface is known for its authentic and flavorful dishes, steering clear of the influencer trend to prioritize quality and taste."
Foul Witch,"Situated in the East Village, Foul Witch is a lesser-known spot that offers a unique dining experience, with a focus on quality food rather than trendy aesthetics."
HAGS,HAGS in the East Village is a hidden gem that stands out for its commitment to serving delicious food without succumbing to the influencer-driven trends.
Reyes Deli,"Located in Brooklyn, Reyes Deli is a hidden gem known for its off-the-grid tacos, offering a unique and authentic taste experience."
Uncle Lou,"A hidden gem in Chinatown, Uncle Lou is celebrated for its affordable and delicious eats, providing a genuine taste of the local cuisine."
Taiwan Pork Chop House,"Situated in Chinatown, Taiwan Pork Chop House is a hidden gem offering flavorful and affordable dishes, making it a favorite among locals."
La Noxe,"A cool cocktail bar that offers a unique experience by entering through a freight elevator and exiting through the 28th Street 1 Train station, providing a secretive and exclusive vibe."
Abandoned City Hall Station,"A hidden architectural gem visible only by staying on the 6 train past its last stop at Brooklyn Bridge-City Hall, offering a glimpse into New York's transit history with its beautiful, unused station."
Fort Tryon Park,"Located away from the main tourist zones, this park offers stunning views of the Hudson River and the Palisades, along with beautiful gardens and a peaceful atmosphere."
Four Freedoms Park,"Situated on Roosevelt Island, this park is a tribute to Franklin D. Roosevelt, offering serene landscapes and a unique perspective of the Manhattan skyline."
Pissilio,"A unique New York spot known for its laughably big Italian sandwiches, offering a memorable and hearty meal experience."
Tsukushi,"A hidden Japanese restaurant near the UN, frequented by Japanese patrons, offering an authentic dining experience with a surprise element for non-Japanese speakers."
Great NY Noodletown,"A classic NYC institution in Chinatown known for its no-frills atmosphere and delicious, affordable eats, attracting a diverse crowd from famous chefs to college students."
That Witch Ales You,"A cozy nano brewery with a tiny storefront and a charming backyard area, offering a unique vibe and a selection of house-brewed beers."
Elevated Acres,"A hidden elevated park behind an office building, accessible via an outdoor escalator, offering a serene escape with views of the Brooklyn Skyline and South Street Seaport."
Whispering Pines Trail,"A serene hiking path nestled in the heart of the forest, offering breathtaking views of untouched nature and a tranquil escape from the bustling city life."
The Enchanted Bookstore,"A quaint, family-owned bookstore filled with rare and antique books, providing a cozy atmosphere for book lovers to explore hidden literary treasures."
Sunset Cove Beach,"A secluded beach with golden sands and crystal-clear waters, perfect for a peaceful day of sunbathing and watching the sun dip below the horizon."
Old Town Artisan Market,"A vibrant market showcasing local artisans and craftsmen, offering unique handmade goods and a glimpse into the region's rich cultural heritage."
Mystic Falls,"A hidden waterfall surrounded by lush greenery, creating a magical setting for nature enthusiasts and photographers alike."
City Hall Station,"A beautifully-designed ghost station from NYC's first subway line, featuring Guastavino tile vaults, skylights, and Romanesque Revival architecture. A time capsule from a more elegant era, accessible through tours by the New York Transit Museum."
Bowling Alley under the Frick Museum,"A hidden two-lane bowling alley in the cellar of the Frick Museum, restored to its original 1914 design. Access is limited to museum members, making it a rare and exclusive experience."
High Bridge in Harlem,"A mid-19th century aqueduct bridge offering breathtaking views of NYC. Reopened in 2015 after a citizen-led campaign, it's a unique attraction for walkers and park-goers."
Rooftop Gardens at Rockefeller Center,"A hidden oasis atop Rockefeller Center, featuring well-tended flowers and a reflective pool. Designed in the 1930s, it's a serene escape from the bustling city below."
Grand Central Terminal's Whispering Spot,An acoustic marvel where whispers can be heard across the archway in the dining concourse. A popular spot for marriage proposals and curious visitors alike.
Ruins of the Smallpox Hospital on Roosevelt Island,"A Gothic Revival architectural landmark with an eerie atmosphere, reflecting NYC's history of combating smallpox. Currently fenced off, but future refurbishment aims to make it accessible."
Berlin Wall Fragment on Madison Avenue,"A five-panel segment of the Berlin Wall located in the lobby of 520 Madison Avenue. One of the largest sections outside Berlin, offering a tangible piece of history."
Loew's Theater,"A vacant 1920s cinema on Canal Street, designed by Thomas Lamb. An official NYC Landmark awaiting restoration, offering a glimpse into the glory days of cinema."
Speakeasies,"Secret cocktail bars with hidden entrances, reminiscent of the Prohibition era. A must-visit for those seeking a unique and nostalgic nightlife experience."
Staten Island Boat Graveyard,"A secluded ship graveyard in Arthur Kill, home to historically significant vessels. A pilgrimage spot for ship enthusiasts, offering an eerie look at aquatic engineering's past."
City Hall Station,"A beautifully-designed ghost station from 1904, featuring Guastavino tile vaults, skylights, and Romanesque Revival architecture. A time capsule from a more elegant era, accessible through tours by the New York Transit Museum."
Bowling Alley under the Frick Museum,"A private two-lane bowling alley hidden in the cellar of the Frick Museum, restored to its original 1914 design. Access is limited to museum members, making it a rare and exclusive experience."
High Bridge in Harlem,"A mid-19th century bridge that once carried water to Manhattan, now a scenic walkway offering breathtaking views of New York City. Reopened in 2015 after a citizen-led campaign."
Rooftop Gardens at Rockefeller Center,"A hidden oasis atop Rockefeller Center, featuring well-tended flowers and a reflective pool. Designed in the 1930s, it offers a serene escape from the bustling city below."
Ruins of the Smallpox Hospital on Roosevelt Island,"A Gothic Revival architectural landmark, this eerie ruin tells the story of New York's battle with smallpox. Though currently fenced off, refurbishment efforts aim to make it accessible in the future."
Berlin Wall Fragment on Madison Avenue,"A five-panel segment of the Berlin Wall located in the lobby of 520 Madison Avenue. One of the largest sections outside Berlin, it offers a tangible piece of history in the heart of New York."
Loew's Theater,"A 1920s cinema designed by Thomas Lamb, now a vacant New York City Landmark awaiting restoration. Offers a glimpse into the golden age of cinema, though access is restricted."
Staten Island Boat Graveyard,"A secluded ship graveyard in Arthur Kill, home to historically significant vessels from the early 20th century. A pilgrimage spot for ship enthusiasts, offering an eerie look at aquatic engineering's past."
Grand Central Terminal's Whispering Spot,An acoustic marvel where whispers can be heard across the archway in the dining concourse. A popular spot for marriage proposals and curious visitors.
Ruins of the Smallpox Hospital on Roosevelt Island,"A Gothic Revival architectural landmark with an eerie atmosphere, reflecting the city's history of combating smallpox. Currently fenced off, with plans for future public access."
Berlin Wall Fragment on Madison Avenue,"A five-panel segment of the Berlin Wall located in the lobby of 520 Madison Avenue. One of the largest intact sections outside Berlin, offering a tangible piece of history."
Loew's Theater,"A vacant 1920s cinema on Canal Street, designed by Thomas Lamb. A New York City Landmark awaiting restoration, offering a glimpse into the golden age of cinema."
Staten Island Boat Graveyard,"A secluded ship graveyard in Arthur Kill, home to historically significant vessels. A pilgrimage spot for ship enthusiasts, offering an eerie look at the past of aquatic engineering."
Rediscover New York,"A platform dedicated to uncovering the hidden gems of New York City and beyond, offering unique insights into lesser-known attractions and cultural spots."
Pier 57 Rooftop Park,"Opened in 2022, this expansive rooftop park offers 360-degree views of Downtown Manhattan and Little Island. It's a serene spot for picnics, sunbathing, and even summer movie screenings, making it a hidden oasis above the bustling city streets."
A Piece of the Berlin Wall in Manhattan,"Located in Kowsky Plaza, Battery Park City, this historical artifact is a piece of the Berlin Wall gifted by the German Consulate. It features iconic street art by Thierry Noir, offering a unique glimpse into history without leaving NYC."
Rainforest Inside the Ford Foundation Building,"A surprising urban jungle located within a skyscraper, this garden houses 40 plant species and a reflecting pool. It's a tranquil escape in the city, complemented by an adjacent art gallery, both free to the public."
Roosevelt Island Tramway,"The oldest urban tramway in the U.S. offers a scenic ride to Roosevelt Island, known for its cherry blossoms and historical sites. The tramway provides stunning views of the Manhattan skyline, making the journey as memorable as the destination."
Greenacre Park,"A peaceful retreat in Midtown Manhattan, this small park features a granite waterfall, vibrant flowers, and ample seating. It's a perfect spot to unwind amidst the city's hustle, offering a serene atmosphere since 1971."
Ace of Diamonds Mine,"Located in Herkimer County, New York, this mine is renowned for its unique double-terminated quartz crystals known as Herkimer diamonds. It's a must-visit for collectors seeking these beautiful and rare gems."
Barton Garnet Mine,"Situated in the Adirondack Mountains, this mine is famous for its high-quality almandine garnet deposits. Visitors can explore and collect garnet crystals in a picturesque mountain setting."
Ilion Gorge,"A hidden gem for fossil enthusiasts, Ilion Gorge offers a chance to find trilobites, brachiopods, and crinoids in its limestone and shale formations, making it a fascinating spot for rockhounding."
Chittenango Falls State Park,"This state park provides rockhounding opportunities along its trails, where visitors can discover various rocks, minerals, and fossils, including trilobites and cephalopods, amidst scenic limestone and shale formations."
Limecrest Quarry,"A popular site for mineral collectors, Limecrest Quarry offers a chance to find calcite, dolomite, and quartz within its limestone and marble deposits, making it a treasure trove for rockhounds."
Greenwood Lake,"Nestled along the shoreline, this location is ideal for finding magnetite, garnet, and hornblende. Its scenic beaches make it a charming spot for both relaxation and rockhounding."
Sunset Cove Beach,"A secluded beach with golden sands and crystal-clear waters, perfect for a peaceful day of relaxation and stunning sunset views."
Mystic Falls,"A hidden waterfall surrounded by lush greenery, known for its mesmerizing beauty and the soothing sound of cascading water."
Greenwich Village,"Known for its proximity to Washington Square Park and the High Line, Greenwich Village offers stunning cityscape views and a variety of local restaurants like Magnolia Bakery and Cafe Cluny, making it a prime location to explore New York City."
SoHo,"A bustling neighborhood south of Greenwich Village, SoHo is famous for its green spaces like Vesuvio Playground and charming shops and cafes along Broadway, offering a unique blend of art and culture."
Sutton Place,"Featuring historic homes in Beaux-Arts and Art Deco styles, Sutton Place offers picturesque views of Roosevelt Island and a relaxing atmosphere at Sutton Place Park, making it a hidden gem for those seeking tranquility in the city."
West Village,"One of New York's oldest neighborhoods, West Village is known for its central location near the Whitney Museum of American Art and Hudson River Park, with a vibrant mix of shops and restaurants like Dante West Village and Perry St."
NoMad,"Full of history and charm, NoMad boasts tree-lined streets, historic buildings, and attractions like Madison Square Park, offering a rich cultural experience with restaurants like Scarpetta and KazuNori."
Tribeca,"Home to attractions like Washington Market Park and the Ghostbusters Headquarters, Tribeca offers charming cobblestone streets and historic architecture, making it a picturesque neighborhood near the Hudson River."
Brooklyn Heights,"Located south of Manhattan, Brooklyn Heights features charming streets with cozy cafes and lively restaurants along Atlantic Avenue, and offers stunning views of Manhattan from Brooklyn Bridge Park and the Brooklyn Heights Promenade."
Queens Night Market,"A vibrant open-air market in Queens offering a diverse array of international street food, unique crafts, and live performances, providing a cultural melting pot experience away from the typical tourist spots."
The Elevated Acre,"A hidden oasis in the Financial District, this secluded rooftop park offers stunning views of the East River and a peaceful escape from the bustling city streets below."
The Whispering Gallery at Grand Central Terminal,"An architectural marvel where visitors can experience the unique acoustic phenomenon of whispering across the gallery's arches, making it a delightful secret for those in the know."
The Cloisters,"A branch of the Metropolitan Museum of Art located in Fort Tryon Park, this museum is dedicated to the art and architecture of medieval Europe, offering a serene and historical retreat with beautiful gardens and views of the Hudson River."
Green-Wood Cemetery,"A historic cemetery in Brooklyn known for its picturesque landscapes, Gothic architecture, and as the final resting place of many notable figures, providing a tranquil and reflective space away from the city's hustle."
Inside an Abandoned NYC Gilded-Age Mansion,"Explore the grandeur of a forgotten era in this landmarked mansion, offering a glimpse into the opulence of New York's Gilded Age. This hidden gem is a testament to architectural beauty and historical significance, tucked away from the bustling city life."
Brooklyn Neighborhood Where Washington Stood,"Step back in time in this historic Brooklyn neighborhood, where George Washington once stood. This area is rich in American history and offers a unique perspective on the nation's past, making it a hidden gem for history enthusiasts."
The Whispering Gallery at Grand Central Terminal,"A unique acoustic phenomenon where whispers can be heard clearly across the gallery, offering a magical experience amidst the hustle and bustle of the terminal."
The Elevated Acre,"A hidden oasis in the Financial District, this rooftop park offers stunning views of the East River and a peaceful escape from the city's chaos."
The Cloisters,"A branch of the Metropolitan Museum of Art, this museum is dedicated to the art and architecture of medieval Europe, set in a tranquil park overlooking the Hudson River."
The City Hall Station,"An abandoned subway station with beautiful architecture and intricate tile work, offering a glimpse into the city's transit history."
The Secret Garden at St. Luke in the Fields,"A serene garden in the West Village, filled with lush greenery and vibrant flowers, providing a quiet retreat from the urban environment."
Yu and Me Books,"A charming bookstore that captures the essence of New York's literary culture, known for its unique selection and the iconic presence of Lucy, a beloved figure in the community."
Liebman’s Deli,"A hidden gem in the city offering authentic deli experiences, cherished for its traditional flavors and the warm hospitality of Yuval, a local favorite."
Village Revival Records,"A quirky record store that stands out for its eclectic collection and the vibrant personality of Jamal, making it a must-visit for music enthusiasts."
Ray’s Candy Store,"An iconic spot known for its nostalgic charm and delicious treats, with a rich history brought to life by the stories of Ray, the heart and soul of the establishment."
Henry’s Army Navy Bags,"A small business that gained recognition for its unique offerings and community support, highlighted by a successful GoFundMe campaign during challenging times."
Astor Place Hairstylists,"An iconic East Village barbershop featured in Nico’s film, known for its vibrant atmosphere and as a gathering place for diverse New York personalities."
Dwellings by Charles Simonds,"A series of tiny clay constructions by Charles Simonds, tucked into buildings and crevices since the 1970s, representing an imaginary civilization of 'Little People' migrating through city streets. Located on a second-floor windowsill and the roof of the Apple store building on Madison Avenue."
Yab-Yum by David Provan,"An artwork featuring 'wind paddles' designed to sway with the underground zephyrs of approaching and departing trains, located in the 34th Street-Herald Square subway station. Despite its worn condition, it remains an exciting discovery for commuters."
Time Landscape by Alan Sonfist,"An ongoing environmental art piece at LaGuardia Place and West Houston Street, recalling the precolonial flora of New York City. Created in 1978, it features an anarchic overgrowth of vegetation, offering a glimpse into the city's natural past."
Masstransiscope by Bill Brand,"A 300-foot-long installation in an abandoned subway tunnel between DeKalb Avenue and the Manhattan Bridge, featuring animated shapes that create a continuous animation when viewed from a moving train. Restored in 2013, it remains a secret delight for subway riders."
Whitehall Crossing by Ming Fay,"Located in the Staten Island Ferry Terminal lobby, this sculpture features 28 sections of rounded granite benches resembling sea serpents. Inspired by Native American dugout canoes, it integrates ferrygoers into the artwork as they sit and wait."
Subway Map Floating on a New York Sidewalk by Françoise Schein,"A 90-by-12-foot stylized subway map embedded in a SoHo sidewalk, symbolizing New York's vitality. Created in 1985, it uses stainless steel, iron, and terrazzo to depict train routes, illuminated by glass discs at night."
Framing Union Square by Mary Miss,"A series of glossy red frames highlighting historical features of the Union Square subway station. Created in 2000, it draws attention to the station's archaeology, encouraging commuters to notice its hidden details."
The Holocaust Memorial by Harriet Feigenbaum,"A marble sculpture on Madison Avenue featuring a stylized chimney of flames and an aerial view of Auschwitz. Created in 1990, it serves as a poignant reminder of past atrocities and the need for vigilance."
7000 Oaks by Joseph Beuys,"A project featuring 38 trees paired with basalt stones along West 22nd Street in Chelsea, part of a global initiative to spark environmental and social change. Begun in 1982, it contrasts the growth of trees with the permanence of stone."
"Reach New York, An Urban Musical Instrument by Christopher Janney","An interactive sound sculpture in the 34th Street-Herald Square subway station, featuring motion-activated sounds that surprise and delight commuters. Created in 1995, it blends natural sounds with the urban environment."
Times Square by Max Neuhaus,"An unmarked sound sculpture beneath a subway grate on Broadway, emitting an unearthly drone. Created in 1977 and relaunched in 2002, it invites passers-by to reflect on the urban environment's mutability."
The Trees Are Watching by Martin & Muñoz,"An installation in the Instituto Cervantes courtyard featuring trees with handcrafted glass eyes, creating an anthropomorphic vision of nature. Installed in 2022, it offers a playful and surprising discovery for visitors."
Tenement Museum,"A unique museum that offers a glimpse into the lives of 19th-century immigrants in NYC, showcasing a typical apartment and the challenges faced by new arrivals."
Museum of Chinese in America (MOCA),"Preserves and presents the 200-year history and culture of Chinese-American communities, featuring exhibits like a recreated Chinese pharmacy."
Lewis H. Latimer House,"A Victorian house in Flushing that was home to black inventor Lewis H. Latimer, known for his work on the first electric lighting system in NYC."
Mmuseumm,"A small museum in lower Manhattan displaying everyday objects that tell global stories, viewable through peepholes 24/7."
National Jazz Museum in Harlem,"A vibrant center dedicated to jazz, offering live performances, exhibitions, and an extensive archive of recorded radio shows."
New York City Fire Museum,"Documents the history of firefighting in NYC, featuring a memorial to FDNY members lost on 9/11 and artifacts from the World Trade Center."
AKC Museum of the Dog,"Located at 101 Park Avenue, this museum celebrates the role of dogs in society through art and interactive displays."
SPYSCAPE Spy Museum,"Explores the world of espionage with interactive exhibits on encryption, surveillance, and covert operations, offering visitors a chance to test their spy skills."
Leslie-Lohman Museum of Art,"Dedicated to LGBTQ art and themes, featuring works by renowned artists like Andy Warhol and David Hockney."
Noguchi Museum,"Showcases the work of Isamu Noguchi, offering a serene environment to appreciate mid-century modernist sculpture and furniture."
Storm King Art Center,"A sprawling outdoor sculpture park in the Hudson Valley, known for its stunning landscape and monumental sculptures that blend art with nature."
Chautauqua Institution,"A cultural retreat on the shores of Chautauqua Lake, offering a unique blend of arts, education, and recreation in a serene setting."
Frederic Remington Art Museum,"Located in the Thousand Islands-Seaway, this museum transports visitors to the Old West with its collection of works by the renowned artist Frederic Remington."
Antique Boat Museum,"Situated in the Thousand Islands-Seaway, this museum showcases the beauty of vintage vessels, offering a glimpse into maritime history."
Clayton Opera House,"A historic venue in the Thousand Islands-Seaway, known for its intimate performances and charming architectural design."
Bethel Woods Center for the Arts,"Located in the Catskills, this center captures the spirit of Woodstock with its concerts and cultural events, set in a picturesque landscape."
National Comedy Center,"In Jamestown, this center offers a humorous journey through the history of comedy, featuring interactive exhibits and memorabilia."
Corning Museum of Glass,"In the Finger Lakes, this museum invites visitors to explore the art and science of glassmaking, with hands-on experiences and stunning exhibits."
Iroquois Museum,"Located in Central New York, this museum celebrates Indigenous art and culture, offering insights into the rich heritage of the Iroquois people."
Hyde Collection,"In the Adirondacks, this museum houses an impressive collection of European and American art, including works by Rembrandt and Picasso."
Tanya Bonakdar Gallery,"A hidden gem in Chelsea, this gallery offers innovative exhibitions and contemporary art, providing a platform for emerging artists."
Casey Kaplan,"Located in Chelsea, this gallery is known for its cutting-edge exhibitions and support for contemporary artists, making it a standout in the art scene."
James Cohan Gallery,"Situated in the Lower East Side, this gallery is celebrated for its diverse artistic practices and commitment to showcasing emerging talent."
Magenta Plains,"A Lower East Side gem, this gallery supports emerging artists and offers a unique space for diverse artistic expressions."
Bushwick Collective,"An outdoor street art haven in Bushwick, where international artists transform industrial walls into vibrant murals, offering a colorful and immersive art experience."
