place_name,place_description
Montague Street,"Situated in Brooklyn Heights, this neighborhood boasts tree-lined sidewalks, cobblestone streets, and a thriving mix of shops and businesses, embodying a strong sense of community."
Park Slope 5th Avenue,"A lively area with locally-owned businesses, unique shopping, delicious restaurants, and a buzzing nightlife, set amongst historical brownstone streets."
Sunset Cove Beach,"A secluded beach with golden sands and crystal-clear waters, perfect for a peaceful day of sunbathing and enjoying stunning sunset views."
Mystic Falls,"A hidden waterfall surrounded by lush greenery, providing a picturesque setting for nature enthusiasts and photographers alike."
LeFrak Center at Lakeside,"A hidden gem within Prospect Park, offering a serene escape with its picturesque lakeside views and a variety of recreational activities including ice skating and boating."
Prospect Park Tennis Center,"Nestled in the heart of the park, this lesser-known spot provides tennis enthusiasts with well-maintained courts and a peaceful setting away from the city's hustle and bustle."
Brooklyn Grange,"An urban farm that offers a unique experience of agriculture in the city, providing fresh produce and a stunning view of the Manhattan skyline."
Clover Club,"A hidden bar known for its exquisite cocktails and intimate ambiance, perfect for a cozy night out in Brooklyn."
Music Hall of Williamsburg,"A hipster concert hall that hosts a variety of live music events, offering a vibrant cultural experience away from the mainstream."
Hidden Gem Boutique,"A quaint and charming boutique located on Fulton Street in New York, known for its unique collection of handcrafted items and vintage finds. This hidden gem offers a cozy shopping experience with personalized service, making it a favorite among locals seeking one-of-a-kind treasures."
Hidden Gem Boutique,"A unique boutique located in Brooklyn, NY, known for its distinctive charm and personalized shopping experience. It stands out for being both Black-owned and women-owned, offering a curated selection of fashion items that reflect cultural significance and diversity."
City Hall Station,"A beautifully-designed ghost station from NYC's first subway line, featuring Guastavino tile vaults and Romanesque Revival architecture. A time capsule from a more elegant era, accessible through tours by the New York Transit Museum."
Grand Central Terminal's Whispering Spot,An acoustic marvel where whispers travel across an archway in the dining concourse. A popular spot for marriage proposals and curious visitors alike.
Ruins of the Smallpox Hospital on Roosevelt Island,"A Gothic Revival landmark with an eerie atmosphere, reflecting NYC's history of combating smallpox. Though currently fenced off, refurbishment efforts aim to make it accessible in the future."
Berlin Wall Fragment on Madison Avenue,"A five-panel segment of the Berlin Wall located in the lobby of 520 Madison Avenue. A significant piece of history, open to the public for viewing."
Speakeasies,"Secret cocktail bars with hidden entrances, reminiscent of the Prohibition era. A must-visit for those seeking a taste of the Roaring Twenties in modern NYC."
Staten Island Boat Graveyard,"A ship graveyard in Arthur Kill, home to decommissioned vessels from the early 20th century. A pilgrimage spot for ship enthusiasts, offering an eerie look at aquatic engineering history."
Tomi Jazz,"A cozy jazz bar located in Midtown East, known for its intimate ambiance and live jazz performances, offering a unique escape from the bustling city streets."
Basement,"An underground venue in Chinatown that offers a mysterious and exclusive atmosphere, perfect for those seeking a hidden nightlife experience."
Nothing Really Matters,"Situated in Midtown West, this spot is known for its laid-back vibe and unique charm, making it a perfect hideaway for those in the know."
The Little Shop,"Located in the Financial District, this quaint spot offers a charming and unexpected retreat amidst the city's financial hustle."
Mr. Fong's,"A trendy bar in Two Bridges, known for its eclectic decor and vibrant atmosphere, attracting a diverse crowd looking for a unique night out."
Sunshine Laundromat & Pinball,"A quirky venue in Greenpoint that combines the nostalgia of a laundromat with the fun of a pinball arcade, offering a playful and unexpected experience."
929,"Located in Long Island City, this spot is highlighted for its unique offerings and hidden charm, providing a special experience away from the mainstream."
Tokyo Record Bar,"A hidden gem that offers a unique dining experience with a focus on vinyl records and Japanese cuisine, creating an intimate and nostalgic atmosphere."
Sake Bar Decibel,"An underground sake bar known for its authentic Japanese ambiance and extensive sake selection, providing a hidden retreat for sake enthusiasts."
Back Room,"A speakeasy-style bar that transports visitors back in time with its Prohibition-era decor and secretive entrance, offering a unique and immersive experience."
Apotheke,"A speakeasy in Chinatown renowned for its creative cocktails and mysterious ambiance, providing a hidden escape for cocktail aficionados."
Ft. Tryon Park and The Cloisters,"Located in the northern part of Manhattan, this park offers a serene escape with its lush greenery and medieval architecture. The Cloisters, a branch of the Metropolitan Museum of Art, houses an impressive collection of medieval art, including stained glass windows featuring dragons, making it a unique cultural experience away from the city's hustle."
Marine Park Salt Marsh Nature Trail,"A hidden natural oasis in Brooklyn, this trail offers a peaceful retreat into nature. Visitors can explore the marshlands and enjoy the tranquility, though it's recommended to wear protective gear against mosquitoes and muck boots for low tide adventures."
Inwood Park by the Hudson,"This lesser-known section of Inwood Park provides a quiet spot for reflection and nature appreciation. Its proximity to the Hudson River offers scenic views, and it's often less crowded, providing a peaceful escape from the city's busy atmosphere."
The Ramble in Central Park,"A serene and often overlooked area of Central Park, offering a tranquil escape with winding paths and lush greenery, perfect for nature lovers seeking a peaceful retreat in the heart of the city."
Fort Tilden,"An abandoned army base with massive gun fortifications to explore, offering a unique adventure for those willing to venture off the beaten path. Caution is advised due to its rugged terrain and remote location."
Jamaica Bay Wildlife Sanctuary,"A haven for bird watchers and nature enthusiasts, this sanctuary offers scenic trails and the opportunity to observe diverse wildlife, providing a refreshing escape from the urban hustle."
New World Mall Food Court,"Located in Flushing, this hidden gem features over 40 food stalls offering a diverse array of authentic Asian cuisines, making it a culinary paradise for adventurous foodies."
Golden Mall,"A lesser-known food destination in Flushing, offering unique dishes like head cheese and pig knuckles, providing a taste of authentic and adventurous Chinese street food."
Louis Armstrong House,"A historic site in Queens dedicated to the legendary jazz musician, offering a glimpse into his life and legacy, making it a must-visit for jazz enthusiasts."
The Cloisters in Fort Tryon Park,"A museum dedicated to medieval art, featuring an impressive collection including the famous unicorn tapestries, set in a picturesque park with stunning views of the Hudson River."
East Broadway,"An authentic Chinatown experience away from the tourist crowds, offering unique culinary delights and a vibrant cultural atmosphere, perfect for those seeking a genuine NYC neighborhood vibe."
Empanada Mama,"A vibrant Latin restaurant known for its delicious and budget-friendly empanadas, located in various spots around Manhattan."
Fraunces Tavern,"New York's oldest bar and restaurant, a historic landmark that once served as a meeting place for the Founding Fathers, with a museum showcasing its rich history."
Los Tacos No.1,"Authentic Mexican taco spot with fresh ingredients imported from Mexico, offering a taste of West Coast flavors in NYC."
Russ & Daughters,"A culinary icon known for its Jewish 'appetizing' foods, offering a unique taste of New York's cultural heritage since 1914."
Mei Lai Wah,"A no-frills Chinese bakery in Chinatown, famous for its fresh, hot char siu bao (roast pork buns) and a favorite among locals."
The Highline,"A transformed old railway line into a public park with art installations and stunning views, perfect for a leisurely walk."
City Climb at Hudson Yards,"The world's highest open-air building ascent, offering thrill-seekers breathtaking views of Manhattan from 1,200 feet above."
Beat the Bomb Brooklyn,"An immersive team experience in Brooklyn, combining video game-like challenges with the thrill of disarming a paint or foam bomb."
Night Markets,"Seasonal markets across NYC boroughs offering diverse cuisines and crafts, perfect for discovering street food trends and unique souvenirs."
The Chelsea Flea,"A historic outdoor flea market offering high-quality antiques and collectibles, beloved by locals and creatives alike."
Glamping on Governors Island,"A serene escape with luxurious tents and villas, offering stunning views of Manhattan and a range of peaceful activities."
The Cloisters,"A medieval art museum in Fort Tryon Park, resembling a European castle with a collection of ancient artifacts and tapestries."
El Museo del Barrio,"A museum in East Harlem dedicated to Latin American and Caribbean art, reflecting the cultural diversity of the neighborhood."
The Tenement Museum,A museum in the Lower East Side showcasing the immigrant experience in NYC through restored tenement apartments.
New York Transit Museum,"Located in a decommissioned subway station, this museum offers a deep dive into NYC's public transit history with vintage artifacts."
The City Reliquary Museum,A community museum in Williamsburg displaying eclectic artifacts that tell unique stories of NYC's past.
The Little Red Lighthouse,"Manhattan's last remaining lighthouse, offering picturesque views and a charming historical backdrop."
African Burial Ground,"A monument and interpretation center honoring the African Americans buried here, reflecting on NYC's history with slavery."
Roosevelt Island Tram,"A unique aerial tramway offering stunning views of NYC, connecting Roosevelt Island with Manhattan's Upper East Side."
Doyer’s Street,"A historically notorious street in Chinatown, now a charming pedestrian area with colorful shops and lanterns."
The Max Family Garden,"Nestled within the historic brick walls of a 19th-century warehouse in Brooklyn's DUMBO neighborhood, this garden is a serene oasis filled with vibrant flowers and picturesque views, offering a charming and elegant backdrop for photos."
Delmonico's,"A historic restaurant with a striking exterior, Delmonico's offers a unique architectural backdrop for photos. Known for its culinary history, including the invention of eggs benedict, it adds a touch of timeless elegance to any image."
Flushing's Chinatown,"A vibrant neighborhood in NYC, Flushing's Chinatown is a photographer's playground with its bright signage, unique textures, and colorful atmosphere. It's perfect for capturing lively and dynamic images while enjoying delicious local snacks."
Gantry Plaza State Park,"Located on an old dockyard, this 12-acre park offers stunning views of the Manhattan skyline, especially at sunset. The historic Pepsi-Cola sign and waterfront spots provide breathtaking backdrops for photos."
Squibb Park Bridge,"Offering epic views of Lower Manhattan, this zig-zag shaped bridge connects Squibb Park to the Greenway. It's a hidden gem for capturing the city skyline, especially when timed with the sun peeking through."
Little Red Lighthouse,"Located under the George Washington Bridge, this vibrant red lighthouse is a unique and colorful photo spot. Built in 1880, it offers guided tours for panoramic views of the Hudson River."
The Beekman,"A luxury hotel with 18th-century charm, The Beekman features jaw-dropping interiors with natural light and antique bookshelves, providing a sophisticated and timeless setting for photos."
Green Acres Park,"A privately owned urban park in Turtle Bay, offering a tranquil and intimate atmosphere. With serene waters and a waterfall, it's a peaceful escape for capturing nature's beauty in the city."
City Hall Subway Station,"NYC's first subway station, opened in 1904, offers a glimpse into the city's history. Although closed in 1945, it remains a beautiful and historic photo spot, accessible through special tours."
Underground Overground Comedy,"A unique comedy experience held in unconventional locations like gyms, rooftops, and barbershops. Shows are announced via Instagram, adding an element of mystery and exclusivity."
Decibel,"A hidden Japanese sake bar in East Village, marked by a subtle 'on air' sign. Known for its intimate atmosphere and extensive sake selection, it's a must-visit for an underground escape."
Bronx Bodega Rave,"An underground rave organized by the legendary Bronx DJ duo Dos Flakos. These secretive parties aim to revitalize the Bronx nightlife scene, with details shared only through Instagram."
See No Evil Pizza,"Located in a subway station, this pizzeria offers a unique dining experience with a full restaurant setup in a previously neglected space, transforming it into a Times Square destination."
Cactus Shop,"A plant store by day, this Williamsburg spot transforms into a Mexican speakeasy at night, featuring authentic decor and drinkware sourced from Mexico, creating a vibrant cultural experience."
Piano Bar Upstairs at Fraunces Tavern,"An intimate piano bar located above one of NYC's oldest establishments, offering live music, a variety of drinks, and a cozy, historic ambiance."
Chez Zou,"A tiny, exclusive bar seating only six patrons, located above Zou Zou's restaurant. Known for its intimate setting and unique entry through an elevator, it's a hidden gem for cocktail enthusiasts."
Nothing Really Matters,"A bar located in a subway station, blending the aesthetics of a 1980s NYC with modern cocktail culture. Its unique location and decor make it a standout spot."
Dom,"A subterranean cocktail lounge in Gramercy with a 'retro-future' theme, offering unique drinks with ingredients from the owner's own line, set in a high-ceilinged, luxurious space."
Peachy's,"A Chinatown cocktail bar with a no-photo policy, known for its vibrant decor and unique cocktails. The bar's ambiance is inspired by the area's historical significance."
Live @ the Apt,"A comedy series that started in a small East Village apartment, now a city-wide phenomenon featuring next-generation talent. Known for its intimate and exclusive performances."
Banzarbar,"An explorer-themed cocktail bar hidden above Freemans, offering a unique tasting menu and a cozy, intimate setting for adventurous drinkers."
Le Boudoir,"A cellar-speakeasy in Brooklyn Heights, designed to resemble Marie Antoinette's chambers, offering a luxurious and historically themed cocktail experience."
Karasu,"A hidden Japanese izakaya behind an unmarked door in Fort Greene, known for its intimate setting and exceptional selection of sake and Japanese whiskey."
Garfunkel's,"A cocktail bar accessed through a secret vault, located in a historic building with a glamorous, old-school aesthetic, offering a unique and exclusive drinking experience."
The catacombs of Old St. Patrick’s Cathedral,"Explore the eerie, candlelit catacombs beneath one of Manhattan's most historic churches, offering a glimpse into NYC's past with guided tours of this underground cemetery."
The Whispering Gallery,"Located in Grand Central Terminal, this acoustic marvel allows whispers to travel across the domed ceiling, creating a romantic and secretive experience for visitors."
The Smallpox Hospital on Roosevelt Island,"Discover the ivy-clad ruins of this Gothic Revival building, once a leading smallpox treatment center, now a hauntingly beautiful landmark on Roosevelt Island."
The Elevated Acre,"A hidden park in the sky offering stunning views of the Brooklyn Bridge and Hudson River, complete with a beer garden and unique light sculpture."
The Old City Hall Subway Stop,"A beautiful, historic subway station closed since 1945, offering a glimpse into NYC's transit past with its elegant architecture, accessible via guided tours or a ride on the 6 train."
Secret gardens of the Rockefeller Center,"High above the bustling streets, these rooftop gardens offer a serene escape with lush greenery and breathtaking views, originally designed in the 1930s."
A piece of the Berlin Wall,"Nestled in a small Midtown plaza, this historic artifact features vibrant murals by German artists, offering a unique piece of history in the heart of NYC."
Track 61 at Waldorf-Astoria Hotel,"A secret train tunnel under the Waldorf-Astoria Hotel, used by VIPs like President Roosevelt to discreetly enter the hotel via a freight elevator, bypassing the street."
Old City Hall Subway Station,"A beautifully preserved subway station closed since 1945, accessible only through special tours by the New York City Transit Museum, showcasing stunning architecture and historical significance."
M42 Room under Grand Central Terminal,"A hidden room beneath Grand Central Terminal, once a crucial power source for trains and a protected site during WWII due to its strategic importance."
Atlantic Avenue Subway Tunnel,"The oldest subway tunnel in the world, located in Brooklyn, previously accessible through tours but now closed, offering a glimpse into early transit history."
Berlin Wall Segment on 53rd St,"A large segment of the Berlin Wall located in a small park between 5th and Madison Ave, offering a unique historical artifact in the heart of NYC."
The Cloisters,"A museum in Upper Manhattan featuring John Rockefeller's medieval art collection, set in a scenic location with views of the Hudson River and George Washington Bridge."
Whispering Gallery in Grand Central,"An architectural marvel where whispers can be heard across the gallery due to its unique curved ceiling, hidden in plain sight within the bustling terminal."
Toynbee Tiles in Midtown,"Mysterious inlaid linoleum tiles embedded in crosswalks, featuring cryptic messages about resurrection on Jupiter, scattered across Midtown and other neighborhoods."
Dentist Office at the Top of Chrysler Building,"A unique dental office located on the 69th floor of the iconic Chrysler Building, offering stunning views and an unusual setting for dental care."
City Hall Station,"A deserted train station with unchanged architecture, offering a glimpse into NYC's past. A must-visit for history and architecture enthusiasts."
Smallpox Hospital,"An abandoned Gothic revival hospital on Roosevelt Island, known for its eerie history and as a haven for cats, making it a unique spot for history buffs and animal lovers."
AKC Dog Museum,"A museum dedicated to dogs, featuring over 4,000 pieces of literature and 1,700 artworks, along with interactive exhibits, perfect for dog lovers and families."
Explorers Club Headquarters,"A treasure trove of artifacts from global explorers, located on the Upper East Side, ideal for those fascinated by history and adventure."
Museum of Jewish Heritage,"A living memorial to Jewish history, featuring personal artifacts and survivor testimonies, fostering reflection on human rights and tolerance."
Museum of the Moving Image,"A unique museum in Queens showcasing historic films and genuine props, including a standout exhibit on the Muppets, perfect for cinema enthusiasts."
Spyscape,"An interactive spy museum where visitors can test their spy skills through various tasks and learn from real CIA or FBI agents, offering a unique and immersive experience."
Color Me Mine,"An art studio on the Upper West Side where visitors can paint custom pottery pieces, providing a relaxing and creative escape from the city's hustle."
Alice Austen House,"A historic site showcasing the work of one of America's first prominent lesbian photographers, offering insights into photography, women's history, and queer art."
Please Don’t Tell,"A speakeasy-style cocktail bar hidden behind a phone booth, offering a secretive and intimate drinking experience reminiscent of the prohibition era."
The Office of Mr Moto,"A bar and museum with a Japanese influence, requiring guests to decode a cipher for entry, offering a mysterious and cryptic experience."
The Elevated Acre,"A rooftop park in the Financial District offering a peaceful retreat with panoramic views, often overlooked by tourists, perfect for a quiet escape."
Jamaica Bay Wildlife Refuge,"A vast wildlife refuge in Queens, home to over 70 bird species and beautiful hiking spots, ideal for nature and bird lovers seeking a break from the city."
Masstransiscope,"A 300-foot art installation by Bill Brand, hidden within a subway tunnel, creating an animated film illusion for train passengers through a series of slits. Located on the B or Q line from Dekalb Avenue."
The Bushwick Collective,"A vibrant collection of murals in Bushwick, Brooklyn, featuring works by local and international artists. Conceived by Joe Ficalora to revive the neighborhood, it's a colorful hidden gem away from Manhattan's main attractions."
Keith Haring's Harlem Mural,"A mural painted by Keith Haring in 1986 during New York's crack epidemic, located in a public park along Harlem River Drive. It holds significant cultural messages and is protected by the City Department of Parks."
New York Earth Room,"A minimalist installation by Walter De Maria in Soho, featuring 280,000 pounds of soil covering 3,600 square feet. Open since 1980, it contrasts the city's concrete landscape."
Mmuseumm,"A miniature museum in Chinatown, housed in an old freight elevator, showcasing found objects and exploring modern humanity through 'Object Journalism.' Created by Alex Calmen and the Safdie brothers."
Dream House,"A sound and light installation in TriBeCa by La Monte Young and Marian Zazeela, offering a meditative experience with neon lights and a continuous sound composition since 1993. Located at 275 Church Street."
Max Neuhaus's Times Square Sound Piece,"A harmonic sound installation disguised as a subway grate in Times Square, producing a steady hum. Originally installed in 1977, it challenges perceptions of sound and sight."
The Morgan Library & Museum,"A cultural complex housing financier Pierpont Morgan's extensive collection of rare books, manuscripts, drawings, and music, set in a neo-classical building. Offers a unique blend of art, history, and research facilities."
AKC Museum of the Dog,"Celebrates the historical role of dogs in human society with interactive displays and fine art, featuring a vast collection of dog-related artifacts and a 4,000-volume library."
The Museum at the Fashion Institute of Technology,"One of the few specialized fashion museums globally, showcasing avant-garde fashion through award-winning exhibitions and educational programs."
Museum of Reclaimed Urban Space (MoRUS),"Highlights grassroots urban space activism in the East Village, showcasing how activists transformed neglected spaces into community gardens and hubs."
SPYSCAPE Spy Museum,"Offers an immersive experience into the world of espionage with interactive exhibits and real spy artifacts, allowing visitors to test their spy skills."
Museum of Chinese in America,"Dedicated to preserving and presenting Chinese-American history and culture through interactive exhibits and cultural programs, fostering cross-cultural understanding."
Mmuseumm,"A tiny museum in a former freight elevator, showcasing unique objects that reflect the world we live in, with a mission to present unconventional exhibitions."
New York City Fire Museum,"Preserves the history of firefighting in NYC, housed in a former firehouse, featuring artifacts, equipment, and a poignant 9/11 memorial tribute."
The Tenement Museum,"Offers a historical perspective on immigration in NYC through a restored tenement building, providing insights into the lives of 19th and 20th-century immigrants."
The Noguchi Museum,"Celebrates the work of sculptor Isamu Noguchi, featuring his sculptures, furniture, and designs, along with educational programs on his artistic impact."
Museum of Moving Image,"Explores the world of TV and film with exhibits on production techniques, film screenings, and behind-the-scenes insights into beloved productions."
New York Transit Museum,"Located in a 1936 subway platform, it showcases the history of NYC's mass transit system with vintage subway cars and interactive exhibits."
Studio Museum in Harlem,"Promotes artists of African descent and black culture through exhibits, educational programs, and an artists-in-residence program that supports emerging talent."
National Jazz Museum in Harlem,"A cultural hub celebrating jazz music with exhibits, educational classes, live performances, and an extensive archive of recorded radio shows."
The Met Cloisters,"Part of the Metropolitan Museum of Art, it houses over 5,000 medieval artifacts in a building composed of French monasteries, offering a glimpse into medieval European art and architecture."
Coney Island Museum,"Celebrates the quirky history of Coney Island with vintage fun house mirrors, sideshow posters, and weekly magic shows, offering a nostalgic experience."
